pi@192.168.248.132's password:
     +--------------------------------------------------------------------+
     ¦                        • MobaXterm 8.6 •                          ¦
     ¦            (SSH client, X-server and networking tools)             ¦
     ¦                                                                    ¦
     ¦ ? SSH session to pi@192.168.248.132                                ¦
     ¦   • SSH compression : ?                                            ¦
     ¦   • SSH-browser     : ?                                            ¦
     ¦   • X11-forwarding  : ?  (remote display is forwarded through SSH) ¦
     ¦   • DISPLAY         : ?  (automatically set on remote server)      ¦
     ¦                                                                    ¦
     ¦ ? For more info, ctrl+click on help or visit our website           ¦
     +--------------------------------------------------------------------+

Linux raspberrypi 4.14.34+ #1110 Mon Apr 16 14:51:42 BST 2018 armv6l

The programs included with the Debian GNU/Linux system are free software;
the exact distribution terms for each program are described in the
individual files in /usr/share/doc/*/copyright.

Debian GNU/Linux comes with ABSOLUTELY NO WARRANTY, to the extent
permitted by applicable law.
Last login: Wed May  9 22:04:58 2018 from 192.168.105.143
pi@raspberrypi:~ $ sudo tcpdump
sudo: tcpdump: command not found
pi@raspberrypi:~ $ sudo apt-get install tcpdump
Reading package lists... Done
Building dependency tree
Reading state information... Done
The following additional packages will be installed:
  libpcap0.8
The following NEW packages will be installed:
  libpcap0.8 tcpdump
0 upgraded, 2 newly installed, 0 to remove and 0 not upgraded.
Need to get 477 kB of archives.
After this operation, 1,213 kB of additional disk space will be used.
Do you want to continue? [Y/n] Y
Get:1 http://mirror.reap.net.nz/raspbian/raspbian stretch/main armhf libpcap0.8 armhf 1.8.1-3 [123 kB]
Get:2 http://mirror.reap.net.nz/raspbian/raspbian stretch/main armhf tcpdump armhf 4.9.2-1~deb9u1 [354 kB]
Fetched 477 kB in 2s (206 kB/s)
Selecting previously unselected package libpcap0.8:armhf.
(Reading database ... 128483 files and directories currently installed.)
Preparing to unpack .../libpcap0.8_1.8.1-3_armhf.deb ...
Unpacking libpcap0.8:armhf (1.8.1-3) ...
Selecting previously unselected package tcpdump.
Preparing to unpack .../tcpdump_4.9.2-1~deb9u1_armhf.deb ...
Unpacking tcpdump (4.9.2-1~deb9u1) ...
Processing triggers for libc-bin (2.24-11+deb9u3) ...
Processing triggers for man-db (2.7.6.1-2) ...
Setting up libpcap0.8:armhf (1.8.1-3) ...
Setting up tcpdump (4.9.2-1~deb9u1) ...
Processing triggers for libc-bin (2.24-11+deb9u3) ...
pi@raspberrypi:~ $ sudo tcpdump | grep my
tcpdump: verbose output suppressed, use -v or -vv for full protocol decode
listening on eth0, link-type EN10MB (Ethernet), capture size 262144 bytes
^C43 packets captured
44 packets received by filter
0 packets dropped by kernel

pi@raspberrypi:~ $ sudo tcpdump | grep -x 22
tcpdump: verbose output suppressed, use -v or -vv for full protocol decode
listening on eth0, link-type EN10MB (Ethernet), capture size 262144 bytes
^C29 packets captured
30 packets received by filter
0 packets dropped by kernel

pi@raspberrypi:~ $ sudo tcpdump
tcpdump: verbose output suppressed, use -v or -vv for full protocol decode
listening on eth0, link-type EN10MB (Ethernet), capture size 262144 bytes
00:32:48.101866 IP 192.168.248.132.ssh > pe205-tc.pcsupport.ac.nz.64741: Flags [P.], seq 1709614295:1709614331, ack 1025157880,                                    win 698, length 36
00:32:48.102667 IP 192.168.248.132.ssh > pe205-tc.pcsupport.ac.nz.64741: Flags [P.], seq 36:72, ack 1, win 698, length 36
00:32:48.103235 IP pe205-tc.pcsupport.ac.nz.64741 > 192.168.248.132.ssh: Flags [.], ack 72, win 2050, length 0
00:32:48.103848 IP 192.168.248.132.ssh > pe205-tc.pcsupport.ac.nz.64741: Flags [P.], seq 72:108, ack 1, win 698, length 36
00:32:48.104623 IP 192.168.248.132.ssh > pe205-tc.pcsupport.ac.nz.64741: Flags [P.], seq 108:144, ack 1, win 698, length 36
00:32:48.105169 IP pe205-tc.pcsupport.ac.nz.64741 > 192.168.248.132.ssh: Flags [.], ack 144, win 2050, length 0
00:32:48.110226 IP 192.168.248.132.37644 > pfwdc01.pcsupport.ac.nz.domain: 23033+ PTR? 132.248.168.192.in-addr.arpa. (46)
00:32:48.115794 IP pe205-tc.pcsupport.ac.nz.64741 > 192.168.248.132.ssh: Flags [.], ack 336, win 2049, length 0
00:32:48.118134 IP pe205-tc.pcsupport.ac.nz.64741 > 192.168.248.132.ssh: Flags [.], ack 424, win 2049, length 0
00:32:48.120487 IP 192.168.248.132.43060 > pfwdc01.pcsupport.ac.nz.domain: 33379+ PTR? 200.105.168.192.in-addr.arpa. (46)
00:32:48.121336 IP pfwdc01.pcsupport.ac.nz.domain > 192.168.248.132.43060: 33379* 1/0/0 PTR pfwdc01.pcsupport.ac.nz. (83)
00:32:48.121722 IP 192.168.248.132.ssh > pe205-tc.pcsupport.ac.nz.64741: Flags [P.], seq 492:576, ack 1, win 698, length 84
00:32:48.122528 IP pe205-tc.pcsupport.ac.nz.64741 > 192.168.248.132.ssh: Flags [.], ack 576, win 2048, length 0
00:32:48.125816 IP 192.168.248.132.ssh > pe205-tc.pcsupport.ac.nz.64741: Flags [P.], seq 676:824, ack 1, win 698, length 148
00:32:48.126590 IP pe205-tc.pcsupport.ac.nz.64741 > 192.168.248.132.ssh: Flags [.], ack 824, win 2047, length 0
00:32:48.128156 IP 192.168.248.132.ssh > pe205-tc.pcsupport.ac.nz.64741: Flags [P.], seq 824:908, ack 1, win 698, length 84
00:32:48.129384 IP 192.168.248.132.ssh > pe205-tc.pcsupport.ac.nz.64741: Flags [P.], seq 908:960, ack 1, win 698, length 52
00:32:48.130024 IP pe205-tc.pcsupport.ac.nz.64741 > 192.168.248.132.ssh: Flags [.], ack 960, win 2053, length 0
00:32:48.131280 IP 192.168.248.132.ssh > pe205-tc.pcsupport.ac.nz.64741: Flags [P.], seq 960:1028, ack 1, win 698, length 68
00:32:48.132612 IP 192.168.248.132.ssh > pe205-tc.pcsupport.ac.nz.64741: Flags [P.], seq 1028:1080, ack 1, win 698, length 52
00:32:48.133308 IP pe205-tc.pcsupport.ac.nz.64741 > 192.168.248.132.ssh: Flags [.], ack 1080, win 2052, length 0
00:32:48.134425 IP 192.168.248.132.ssh > pe205-tc.pcsupport.ac.nz.64741: Flags [P.], seq 1080:1148, ack 1, win 698, length 68
00:32:48.135649 IP 192.168.248.132.ssh > pe205-tc.pcsupport.ac.nz.64741: Flags [P.], seq 1148:1200, ack 1, win 698, length 52
00:32:48.136431 IP pe205-tc.pcsupport.ac.nz.64741 > 192.168.248.132.ssh: Flags [.], ack 1200, win 2052, length 0
00:32:48.137489 IP 192.168.248.132.ssh > pe205-tc.pcsupport.ac.nz.64741: Flags [P.], seq 1200:1260, ack 1, win 698, length 60
00:32:48.138806 IP 192.168.248.132.ssh > pe205-tc.pcsupport.ac.nz.64741: Flags [P.], seq 1260:1312, ack 1, win 698, length 52
00:32:48.139494 IP pe205-tc.pcsupport.ac.nz.64741 > 192.168.248.132.ssh: Flags [.], ack 1312, win 2051, length 0
00:32:48.140698 IP 192.168.248.132.ssh > pe205-tc.pcsupport.ac.nz.64741: Flags [P.], seq 1312:1372, ack 1, win 698, length 60
00:32:48.141960 IP 192.168.248.132.ssh > pe205-tc.pcsupport.ac.nz.64741: Flags [P.], seq 1372:1424, ack 1, win 698, length 52
00:32:48.142717 IP pe205-tc.pcsupport.ac.nz.64741 > 192.168.248.132.ssh: Flags [.], ack 1424, win 2051, length 0
00:32:48.143779 IP 192.168.248.132.ssh > pe205-tc.pcsupport.ac.nz.64741: Flags [P.], seq 1424:1484, ack 1, win 698, length 60
00:32:48.145000 IP 192.168.248.132.ssh > pe205-tc.pcsupport.ac.nz.64741: Flags [P.], seq 1484:1536, ack 1, win 698, length 52
00:32:48.145369 IP pe205-tc.pcsupport.ac.nz.64741 > 192.168.248.132.ssh: Flags [P.], seq 1:69, ack 1484, win 2051, length 68
00:32:48.145472 IP pe205-tc.pcsupport.ac.nz.64741 > 192.168.248.132.ssh: Flags [P.], seq 69:105, ack 1484, win 2051, length 36
00:32:48.146539 IP 192.168.248.132.ssh > pe205-tc.pcsupport.ac.nz.64741: Flags [.], ack 105, win 698, length 0
00:32:48.148371 IP 192.168.248.132.ssh > pe205-tc.pcsupport.ac.nz.64741: Flags [P.], seq 1536:1664, ack 105, win 698, length 12                                   8
00:32:48.149140 IP pe205-tc.pcsupport.ac.nz.64741 > 192.168.248.132.ssh: Flags [.], ack 1664, win 2050, length 0
00:32:48.150117 IP 192.168.248.132.ssh > pe205-tc.pcsupport.ac.nz.64741: Flags [P.], seq 1664:1716, ack 105, win 698, length 52
00:32:48.151351 IP 192.168.248.132.ssh > pe205-tc.pcsupport.ac.nz.64741: Flags [P.], seq 1716:1784, ack 105, win 698, length 68
00:32:48.152118 IP pe205-tc.pcsupport.ac.nz.64741 > 192.168.248.132.ssh: Flags [.], ack 1784, win 2049, length 0
00:32:48.153095 IP 192.168.248.132.ssh > pe205-tc.pcsupport.ac.nz.64741: Flags [P.], seq 1784:1844, ack 105, win 698, length 60
00:32:48.154331 IP 192.168.248.132.ssh > pe205-tc.pcsupport.ac.nz.64741: Flags [P.], seq 1844:1912, ack 105, win 698, length 68
00:32:48.155117 IP pe205-tc.pcsupport.ac.nz.64741 > 192.168.248.132.ssh: Flags [.], ack 1912, win 2049, length 0
00:32:48.156183 IP 192.168.248.132.ssh > pe205-tc.pcsupport.ac.nz.64741: Flags [P.], seq 1912:1964, ack 105, win 698, length 52
00:32:48.157372 IP 192.168.248.132.ssh > pe205-tc.pcsupport.ac.nz.64741: Flags [P.], seq 1964:2024, ack 105, win 698, length 60
00:32:48.158139 IP pe205-tc.pcsupport.ac.nz.64741 > 192.168.248.132.ssh: Flags [.], ack 2024, win 2048, length 0
00:32:48.159235 IP 192.168.248.132.ssh > pe205-tc.pcsupport.ac.nz.64741: Flags [P.], seq 2024:2076, ack 105, win 698, length 52
00:32:48.160461 IP 192.168.248.132.ssh > pe205-tc.pcsupport.ac.nz.64741: Flags [P.], seq 2076:2136, ack 105, win 698, length 60
00:32:48.161066 IP pe205-tc.pcsupport.ac.nz.64741 > 192.168.248.132.ssh: Flags [.], ack 2136, win 2048, length 0
00:32:48.162142 IP 192.168.248.132.ssh > pe205-tc.pcsupport.ac.nz.64741: Flags [P.], seq 2136:2188, ack 105, win 698, length 52
00:32:48.163360 IP 192.168.248.132.ssh > pe205-tc.pcsupport.ac.nz.64741: Flags [P.], seq 2188:2256, ack 105, win 698, length 68
00:32:48.163994 IP pe205-tc.pcsupport.ac.nz.64741 > 192.168.248.132.ssh: Flags [.], ack 2256, win 2048, length 0
00:32:48.165080 IP 192.168.248.132.ssh > pe205-tc.pcsupport.ac.nz.64741: Flags [P.], seq 2256:2308, ack 105, win 698, length 52
00:32:48.166525 IP 192.168.248.132.ssh > pe205-tc.pcsupport.ac.nz.64741: Flags [P.], seq 2308:2368, ack 105, win 698, length 60
00:32:48.167224 IP pe205-tc.pcsupport.ac.nz.64741 > 192.168.248.132.ssh: Flags [.], ack 2368, win 2047, length 0
00:32:48.168322 IP 192.168.248.132.ssh > pe205-tc.pcsupport.ac.nz.64741: Flags [P.], seq 2368:2412, ack 105, win 698, length 44
00:32:48.169527 IP 192.168.248.132.ssh > pe205-tc.pcsupport.ac.nz.64741: Flags [P.], seq 2412:2472, ack 105, win 698, length 60
00:32:48.170309 IP pe205-tc.pcsupport.ac.nz.64741 > 192.168.248.132.ssh: Flags [.], ack 2472, win 2053, length 0
00:32:48.171259 IP 192.168.248.132.ssh > pe205-tc.pcsupport.ac.nz.64741: Flags [P.], seq 2472:2524, ack 105, win 698, length 52
00:32:48.172587 IP 192.168.248.132.ssh > pe205-tc.pcsupport.ac.nz.64741: Flags [P.], seq 2524:2592, ack 105, win 698, length 68
00:32:48.173316 IP pe205-tc.pcsupport.ac.nz.64741 > 192.168.248.132.ssh: Flags [.], ack 2592, win 2052, length 0
00:32:48.174271 IP 192.168.248.132.ssh > pe205-tc.pcsupport.ac.nz.64741: Flags [P.], seq 2592:2644, ack 105, win 698, length 52
00:32:48.175543 IP 192.168.248.132.ssh > pe205-tc.pcsupport.ac.nz.64741: Flags [P.], seq 2644:2704, ack 105, win 698, length 60
00:32:48.176311 IP pe205-tc.pcsupport.ac.nz.64741 > 192.168.248.132.ssh: Flags [.], ack 2704, win 2052, length 0
00:32:48.177284 IP 192.168.248.132.ssh > pe205-tc.pcsupport.ac.nz.64741: Flags [P.], seq 2704:2756, ack 105, win 698, length 52
00:32:48.178607 IP 192.168.248.132.ssh > pe205-tc.pcsupport.ac.nz.64741: Flags [P.], seq 2756:2816, ack 105, win 698, length 60
00:32:48.179372 IP pe205-tc.pcsupport.ac.nz.64741 > 192.168.248.132.ssh: Flags [.], ack 2816, win 2051, length 0
00:32:48.180418 IP 192.168.248.132.ssh > pe205-tc.pcsupport.ac.nz.64741: Flags [P.], seq 2816:2868, ack 105, win 698, length 52
00:32:48.181650 IP 192.168.248.132.ssh > pe205-tc.pcsupport.ac.nz.64741: Flags [P.], seq 2868:2928, ack 105, win 698, length 60
00:32:48.182472 IP pe205-tc.pcsupport.ac.nz.64741 > 192.168.248.132.ssh: Flags [.], ack 2928, win 2051, length 0
00:32:48.183432 IP 192.168.248.132.ssh > pe205-tc.pcsupport.ac.nz.64741: Flags [P.], seq 2928:2980, ack 105, win 698, length 52
00:32:48.184670 IP 192.168.248.132.ssh > pe205-tc.pcsupport.ac.nz.64741: Flags [P.], seq 2980:3040, ack 105, win 698, length 60
00:32:48.185436 IP pe205-tc.pcsupport.ac.nz.64741 > 192.168.248.132.ssh: Flags [.], ack 3040, win 2050, length 0
00:32:48.186392 IP 192.168.248.132.ssh > pe205-tc.pcsupport.ac.nz.64741: Flags [P.], seq 3040:3092, ack 105, win 698, length 52
00:32:48.187606 IP 192.168.248.132.ssh > pe205-tc.pcsupport.ac.nz.64741: Flags [P.], seq 3092:3152, ack 105, win 698, length 60
00:32:48.188444 IP pe205-tc.pcsupport.ac.nz.64741 > 192.168.248.132.ssh: Flags [.], ack 3152, win 2050, length 0
00:32:48.189442 IP 192.168.248.132.ssh > pe205-tc.pcsupport.ac.nz.64741: Flags [P.], seq 3152:3204, ack 105, win 698, length 52
00:32:48.190741 IP 192.168.248.132.ssh > pe205-tc.pcsupport.ac.nz.64741: Flags [P.], seq 3204:3264, ack 105, win 698, length 60
00:32:48.191413 IP pe205-tc.pcsupport.ac.nz.64741 > 192.168.248.132.ssh: Flags [.], ack 3264, win 2050, length 0
00:32:48.192453 IP 192.168.248.132.ssh > pe205-tc.pcsupport.ac.nz.64741: Flags [P.], seq 3264:3316, ack 105, win 698, length 52
00:32:48.193798 IP 192.168.248.132.ssh > pe205-tc.pcsupport.ac.nz.64741: Flags [P.], seq 3316:3376, ack 105, win 698, length 60
00:32:48.194502 IP pe205-tc.pcsupport.ac.nz.64741 > 192.168.248.132.ssh: Flags [.], ack 3376, win 2049, length 0
00:32:48.195500 IP 192.168.248.132.ssh > pe205-tc.pcsupport.ac.nz.64741: Flags [P.], seq 3376:3428, ack 105, win 698, length 52
00:32:48.196801 IP 192.168.248.132.ssh > pe205-tc.pcsupport.ac.nz.64741: Flags [P.], seq 3428:3488, ack 105, win 698, length 60
00:32:48.197550 IP pe205-tc.pcsupport.ac.nz.64741 > 192.168.248.132.ssh: Flags [.], ack 3488, win 2049, length 0
00:32:48.198608 IP 192.168.248.132.ssh > pe205-tc.pcsupport.ac.nz.64741: Flags [P.], seq 3488:3540, ack 105, win 698, length 52
00:32:48.199805 IP 192.168.248.132.ssh > pe205-tc.pcsupport.ac.nz.64741: Flags [P.], seq 3540:3600, ack 105, win 698, length 60
00:32:48.200534 IP pe205-tc.pcsupport.ac.nz.64741 > 192.168.248.132.ssh: Flags [.], ack 3600, win 2048, length 0
00:32:48.201476 IP 192.168.248.132.ssh > pe205-tc.pcsupport.ac.nz.64741: Flags [P.], seq 3600:3652, ack 105, win 698, length 52
00:32:48.202689 IP 192.168.248.132.ssh > pe205-tc.pcsupport.ac.nz.64741: Flags [P.], seq 3652:3712, ack 105, win 698, length 60
00:32:48.203472 IP pe205-tc.pcsupport.ac.nz.64741 > 192.168.248.132.ssh: Flags [.], ack 3712, win 2048, length 0
00:32:48.204545 IP 192.168.248.132.ssh > pe205-tc.pcsupport.ac.nz.64741: Flags [P.], seq 3712:3764, ack 105, win 698, length 52
00:32:48.205801 IP 192.168.248.132.ssh > pe205-tc.pcsupport.ac.nz.64741: Flags [P.], seq 3764:3824, ack 105, win 698, length 60
00:32:48.206542 IP pe205-tc.pcsupport.ac.nz.64741 > 192.168.248.132.ssh: Flags [.], ack 3824, win 2047, length 0
00:32:48.207488 IP 192.168.248.132.ssh > pe205-tc.pcsupport.ac.nz.64741: Flags [P.], seq 3824:3876, ack 105, win 698, length 52
00:32:48.208783 IP 192.168.248.132.ssh > pe205-tc.pcsupport.ac.nz.64741: Flags [P.], seq 3876:3936, ack 105, win 698, length 60
00:32:48.209526 IP pe205-tc.pcsupport.ac.nz.64741 > 192.168.248.132.ssh: Flags [.], ack 3936, win 2053, length 0
00:32:48.210517 IP 192.168.248.132.ssh > pe205-tc.pcsupport.ac.nz.64741: Flags [P.], seq 3936:3988, ack 105, win 698, length 52
00:32:48.211773 IP 192.168.248.132.ssh > pe205-tc.pcsupport.ac.nz.64741: Flags [P.], seq 3988:4048, ack 105, win 698, length 60
00:32:48.212546 IP pe205-tc.pcsupport.ac.nz.64741 > 192.168.248.132.ssh: Flags [.], ack 4048, win 2052, length 0
00:32:48.213225 IP pe205-tc.pcsupport.ac.nz.64741 > 192.168.248.132.ssh: Flags [P.], seq 105:141, ack 4048, win 2052, length 36
00:32:48.213308 IP pe205-tc.pcsupport.ac.nz.64741 > 192.168.248.132.ssh: Flags [P.], seq 141:177, ack 4048, win 2052, length 36
00:32:48.214372 IP 192.168.248.132.ssh > pe205-tc.pcsupport.ac.nz.64741: Flags [.], ack 177, win 698, length 0
00:32:48.215099 IP 192.168.248.132.ssh > pe205-tc.pcsupport.ac.nz.64741: Flags [P.], seq 4048:4092, ack 177, win 698, length 44
00:32:48.216698 IP 192.168.248.132.ssh > pe205-tc.pcsupport.ac.nz.64741: Flags [P.], seq 4092:4228, ack 177, win 698, length 13                                   6
00:32:48.217453 IP pe205-tc.pcsupport.ac.nz.64741 > 192.168.248.132.ssh: Flags [.], ack 4228, win 2051, length 0
00:32:48.218629 IP 192.168.248.132.ssh > pe205-tc.pcsupport.ac.nz.64741: Flags [P.], seq 4228:4296, ack 177, win 698, length 68
00:32:48.220009 IP 192.168.248.132.ssh > pe205-tc.pcsupport.ac.nz.64741: Flags [P.], seq 4296:4364, ack 177, win 698, length 68
00:32:48.220790 IP pe205-tc.pcsupport.ac.nz.64741 > 192.168.248.132.ssh: Flags [.], ack 4364, win 2051, length 0
00:32:48.221823 IP 192.168.248.132.ssh > pe205-tc.pcsupport.ac.nz.64741: Flags [P.], seq 4364:4416, ack 177, win 698, length 52
00:32:48.223067 IP 192.168.248.132.ssh > pe205-tc.pcsupport.ac.nz.64741: Flags [P.], seq 4416:4476, ack 177, win 698, length 60
00:32:48.223662 IP pe205-tc.pcsupport.ac.nz.64741 > 192.168.248.132.ssh: Flags [.], ack 4476, win 2051, length 0
00:32:48.224766 IP 192.168.248.132.ssh > pe205-tc.pcsupport.ac.nz.64741: Flags [P.], seq 4476:4528, ack 177, win 698, length 52
00:32:48.225996 IP 192.168.248.132.ssh > pe205-tc.pcsupport.ac.nz.64741: Flags [P.], seq 4528:4588, ack 177, win 698, length 60
00:32:48.226792 IP pe205-tc.pcsupport.ac.nz.64741 > 192.168.248.132.ssh: Flags [.], ack 4588, win 2050, length 0
00:32:48.227871 IP 192.168.248.132.ssh > pe205-tc.pcsupport.ac.nz.64741: Flags [P.], seq 4588:4640, ack 177, win 698, length 52
00:32:48.229175 IP 192.168.248.132.ssh > pe205-tc.pcsupport.ac.nz.64741: Flags [P.], seq 4640:4700, ack 177, win 698, length 60
00:32:48.229997 IP pe205-tc.pcsupport.ac.nz.64741 > 192.168.248.132.ssh: Flags [.], ack 4700, win 2050, length 0
00:32:48.230966 IP 192.168.248.132.ssh > pe205-tc.pcsupport.ac.nz.64741: Flags [P.], seq 4700:4752, ack 177, win 698, length 52
00:32:48.232180 IP 192.168.248.132.ssh > pe205-tc.pcsupport.ac.nz.64741: Flags [P.], seq 4752:4812, ack 177, win 698, length 60
00:32:48.233018 IP pe205-tc.pcsupport.ac.nz.64741 > 192.168.248.132.ssh: Flags [.], ack 4812, win 2049, length 0
00:32:48.234017 IP 192.168.248.132.ssh > pe205-tc.pcsupport.ac.nz.64741: Flags [P.], seq 4812:4864, ack 177, win 698, length 52
00:32:48.235291 IP 192.168.248.132.ssh > pe205-tc.pcsupport.ac.nz.64741: Flags [P.], seq 4864:4924, ack 177, win 698, length 60
00:32:48.236059 IP pe205-tc.pcsupport.ac.nz.64741 > 192.168.248.132.ssh: Flags [.], ack 4924, win 2049, length 0
00:32:48.237099 IP 192.168.248.132.ssh > pe205-tc.pcsupport.ac.nz.64741: Flags [P.], seq 4924:4976, ack 177, win 698, length 52
00:32:48.238535 IP 192.168.248.132.ssh > pe205-tc.pcsupport.ac.nz.64741: Flags [P.], seq 4976:5036, ack 177, win 698, length 60
00:32:48.239273 IP pe205-tc.pcsupport.ac.nz.64741 > 192.168.248.132.ssh: Flags [.], ack 5036, win 2048, length 0
00:32:48.240253 IP 192.168.248.132.ssh > pe205-tc.pcsupport.ac.nz.64741: Flags [P.], seq 5036:5080, ack 177, win 698, length 44
00:32:48.241466 IP 192.168.248.132.ssh > pe205-tc.pcsupport.ac.nz.64741: Flags [P.], seq 5080:5140, ack 177, win 698, length 60
00:32:48.242296 IP pe205-tc.pcsupport.ac.nz.64741 > 192.168.248.132.ssh: Flags [.], ack 5140, win 2048, length 0
00:32:48.243270 IP 192.168.248.132.ssh > pe205-tc.pcsupport.ac.nz.64741: Flags [P.], seq 5140:5192, ack 177, win 698, length 52
00:32:48.244585 IP 192.168.248.132.ssh > pe205-tc.pcsupport.ac.nz.64741: Flags [P.], seq 5192:5252, ack 177, win 698, length 60
00:32:48.245360 IP pe205-tc.pcsupport.ac.nz.64741 > 192.168.248.132.ssh: Flags [.], ack 5252, win 2047, length 0
00:32:48.246342 IP 192.168.248.132.ssh > pe205-tc.pcsupport.ac.nz.64741: Flags [P.], seq 5252:5304, ack 177, win 698, length 52
00:32:48.247662 IP 192.168.248.132.ssh > pe205-tc.pcsupport.ac.nz.64741: Flags [P.], seq 5304:5364, ack 177, win 698, length 60
00:32:48.248431 IP pe205-tc.pcsupport.ac.nz.64741 > 192.168.248.132.ssh: Flags [.], ack 5364, win 2047, length 0
00:32:48.249453 IP 192.168.248.132.ssh > pe205-tc.pcsupport.ac.nz.64741: Flags [P.], seq 5364:5408, ack 177, win 698, length 44
00:32:48.250721 IP 192.168.248.132.ssh > pe205-tc.pcsupport.ac.nz.64741: Flags [P.], seq 5408:5468, ack 177, win 698, length 60
00:32:48.251391 IP pe205-tc.pcsupport.ac.nz.64741 > 192.168.248.132.ssh: Flags [.], ack 5468, win 2053, length 0
00:32:48.252533 IP 192.168.248.132.ssh > pe205-tc.pcsupport.ac.nz.64741: Flags [P.], seq 5468:5520, ack 177, win 698, length 52
00:32:48.253790 IP 192.168.248.132.ssh > pe205-tc.pcsupport.ac.nz.64741: Flags [P.], seq 5520:5580, ack 177, win 698, length 60
00:32:48.254471 IP pe205-tc.pcsupport.ac.nz.64741 > 192.168.248.132.ssh: Flags [.], ack 5580, win 2052, length 0
00:32:48.255478 IP 192.168.248.132.ssh > pe205-tc.pcsupport.ac.nz.64741: Flags [P.], seq 5580:5632, ack 177, win 698, length 52
00:32:48.256778 IP 192.168.248.132.ssh > pe205-tc.pcsupport.ac.nz.64741: Flags [P.], seq 5632:5692, ack 177, win 698, length 60
00:32:48.257545 IP pe205-tc.pcsupport.ac.nz.64741 > 192.168.248.132.ssh: Flags [.], ack 5692, win 2052, length 0
00:32:48.258644 IP 192.168.248.132.ssh > pe205-tc.pcsupport.ac.nz.64741: Flags [P.], seq 5692:5744, ack 177, win 698, length 52
00:32:48.260029 IP 192.168.248.132.ssh > pe205-tc.pcsupport.ac.nz.64741: Flags [P.], seq 5744:5804, ack 177, win 698, length 60
00:32:48.260804 IP pe205-tc.pcsupport.ac.nz.64741 > 192.168.248.132.ssh: Flags [.], ack 5804, win 2051, length 0
00:32:48.261789 IP 192.168.248.132.ssh > pe205-tc.pcsupport.ac.nz.64741: Flags [P.], seq 5804:5856, ack 177, win 698, length 52
00:32:48.263017 IP 192.168.248.132.ssh > pe205-tc.pcsupport.ac.nz.64741: Flags [P.], seq 5856:5916, ack 177, win 698, length 60
00:32:48.263773 IP pe205-tc.pcsupport.ac.nz.64741 > 192.168.248.132.ssh: Flags [.], ack 5916, win 2051, length 0
00:32:48.264724 IP 192.168.248.132.ssh > pe205-tc.pcsupport.ac.nz.64741: Flags [P.], seq 5916:5968, ack 177, win 698, length 52
00:32:48.265929 IP 192.168.248.132.ssh > pe205-tc.pcsupport.ac.nz.64741: Flags [P.], seq 5968:6028, ack 177, win 698, length 60
00:32:48.266695 IP pe205-tc.pcsupport.ac.nz.64741 > 192.168.248.132.ssh: Flags [.], ack 6028, win 2050, length 0
00:32:48.267656 IP 192.168.248.132.ssh > pe205-tc.pcsupport.ac.nz.64741: Flags [P.], seq 6028:6080, ack 177, win 698, length 52
00:32:48.269061 IP 192.168.248.132.ssh > pe205-tc.pcsupport.ac.nz.64741: Flags [P.], seq 6080:6140, ack 177, win 698, length 60
00:32:48.269845 IP pe205-tc.pcsupport.ac.nz.64741 > 192.168.248.132.ssh: Flags [.], ack 6140, win 2050, length 0
00:32:48.270797 IP 192.168.248.132.ssh > pe205-tc.pcsupport.ac.nz.64741: Flags [P.], seq 6140:6192, ack 177, win 698, length 52
00:32:48.272038 IP 192.168.248.132.ssh > pe205-tc.pcsupport.ac.nz.64741: Flags [P.], seq 6192:6252, ack 177, win 698, length 60
00:32:48.272820 IP pe205-tc.pcsupport.ac.nz.64741 > 192.168.248.132.ssh: Flags [.], ack 6252, win 2050, length 0
00:32:48.273796 IP 192.168.248.132.ssh > pe205-tc.pcsupport.ac.nz.64741: Flags [P.], seq 6252:6304, ack 177, win 698, length 52
00:32:48.275103 IP 192.168.248.132.ssh > pe205-tc.pcsupport.ac.nz.64741: Flags [P.], seq 6304:6364, ack 177, win 698, length 60
00:32:48.275892 IP pe205-tc.pcsupport.ac.nz.64741 > 192.168.248.132.ssh: Flags [.], ack 6364, win 2049, length 0
00:32:48.276846 IP 192.168.248.132.ssh > pe205-tc.pcsupport.ac.nz.64741: Flags [P.], seq 6364:6408, ack 177, win 698, length 44
00:32:48.278184 IP 192.168.248.132.ssh > pe205-tc.pcsupport.ac.nz.64741: Flags [P.], seq 6408:6468, ack 177, win 698, length 60
00:32:48.278954 IP pe205-tc.pcsupport.ac.nz.64741 > 192.168.248.132.ssh: Flags [.], ack 6468, win 2049, length 0
00:32:48.279907 IP 192.168.248.132.ssh > pe205-tc.pcsupport.ac.nz.64741: Flags [P.], seq 6468:6512, ack 177, win 698, length 44
00:32:48.281122 IP 192.168.248.132.ssh > pe205-tc.pcsupport.ac.nz.64741: Flags [P.], seq 6512:6572, ack 177, win 698, length 60
00:32:48.281532 IP pe205-tc.pcsupport.ac.nz.64741 > 192.168.248.132.ssh: Flags [P.], seq 177:213, ack 6512, win 2049, length 36
00:32:48.281635 IP pe205-tc.pcsupport.ac.nz.64741 > 192.168.248.132.ssh: Flags [P.], seq 213:249, ack 6512, win 2049, length 36
00:32:48.282978 IP 192.168.248.132.ssh > pe205-tc.pcsupport.ac.nz.64741: Flags [.], ack 249, win 698, length 0
00:32:48.283747 IP 192.168.248.132.ssh > pe205-tc.pcsupport.ac.nz.64741: Flags [P.], seq 6572:6624, ack 249, win 698, length 52
00:32:48.284403 IP pe205-tc.pcsupport.ac.nz.64741 > 192.168.248.132.ssh: Flags [.], ack 6624, win 2048, length 0
00:32:48.285915 IP 192.168.248.132.ssh > pe205-tc.pcsupport.ac.nz.64741: Flags [P.], seq 6624:6752, ack 249, win 698, length 12                                   8
00:32:48.287384 IP 192.168.248.132.ssh > pe205-tc.pcsupport.ac.nz.64741: Flags [P.], seq 6752:6836, ack 249, win 698, length 84
00:32:48.288125 IP pe205-tc.pcsupport.ac.nz.64741 > 192.168.248.132.ssh: Flags [.], ack 6836, win 2047, length 0
00:32:48.289228 IP 192.168.248.132.ssh > pe205-tc.pcsupport.ac.nz.64741: Flags [P.], seq 6836:6888, ack 249, win 698, length 52
00:32:48.290554 IP 192.168.248.132.ssh > pe205-tc.pcsupport.ac.nz.64741: Flags [P.], seq 6888:6956, ack 249, win 698, length 68
00:32:48.291326 IP pe205-tc.pcsupport.ac.nz.64741 > 192.168.248.132.ssh: Flags [.], ack 6956, win 2053, length 0
00:32:48.292392 IP 192.168.248.132.ssh > pe205-tc.pcsupport.ac.nz.64741: Flags [P.], seq 6956:7008, ack 249, win 698, length 52
00:32:48.293677 IP 192.168.248.132.ssh > pe205-tc.pcsupport.ac.nz.64741: Flags [P.], seq 7008:7068, ack 249, win 698, length 60
00:32:48.294450 IP pe205-tc.pcsupport.ac.nz.64741 > 192.168.248.132.ssh: Flags [.], ack 7068, win 2052, length 0
00:32:48.295411 IP 192.168.248.132.ssh > pe205-tc.pcsupport.ac.nz.64741: Flags [P.], seq 7068:7120, ack 249, win 698, length 52
00:32:48.296672 IP 192.168.248.132.ssh > pe205-tc.pcsupport.ac.nz.64741: Flags [P.], seq 7120:7180, ack 249, win 698, length 60
00:32:48.297482 IP pe205-tc.pcsupport.ac.nz.64741 > 192.168.248.132.ssh: Flags [.], ack 7180, win 2052, length 0
00:32:48.298574 IP 192.168.248.132.ssh > pe205-tc.pcsupport.ac.nz.64741: Flags [P.], seq 7180:7232, ack 249, win 698, length 52
00:32:48.299920 IP 192.168.248.132.ssh > pe205-tc.pcsupport.ac.nz.64741: Flags [P.], seq 7232:7292, ack 249, win 698, length 60
00:32:48.300655 IP pe205-tc.pcsupport.ac.nz.64741 > 192.168.248.132.ssh: Flags [.], ack 7292, win 2051, length 0
00:32:48.301649 IP 192.168.248.132.ssh > pe205-tc.pcsupport.ac.nz.64741: Flags [P.], seq 7292:7344, ack 249, win 698, length 52
00:32:48.302916 IP 192.168.248.132.ssh > pe205-tc.pcsupport.ac.nz.64741: Flags [P.], seq 7344:7412, ack 249, win 698, length 68
00:32:48.303740 IP pe205-tc.pcsupport.ac.nz.64741 > 192.168.248.132.ssh: Flags [.], ack 7412, win 2051, length 0
00:32:48.304723 IP 192.168.248.132.ssh > pe205-tc.pcsupport.ac.nz.64741: Flags [P.], seq 7412:7464, ack 249, win 698, length 52
00:32:48.306011 IP 192.168.248.132.ssh > pe205-tc.pcsupport.ac.nz.64741: Flags [P.], seq 7464:7524, ack 249, win 698, length 60
00:32:48.306779 IP pe205-tc.pcsupport.ac.nz.64741 > 192.168.248.132.ssh: Flags [.], ack 7524, win 2050, length 0
00:32:48.307978 IP 192.168.248.132.ssh > pe205-tc.pcsupport.ac.nz.64741: Flags [P.], seq 7524:7568, ack 249, win 698, length 44
00:32:48.309265 IP 192.168.248.132.ssh > pe205-tc.pcsupport.ac.nz.64741: Flags [P.], seq 7568:7628, ack 249, win 698, length 60
00:32:48.310044 IP pe205-tc.pcsupport.ac.nz.64741 > 192.168.248.132.ssh: Flags [.], ack 7628, win 2050, length 0
00:32:48.311073 IP 192.168.248.132.ssh > pe205-tc.pcsupport.ac.nz.64741: Flags [P.], seq 7628:7680, ack 249, win 698, length 52
00:32:48.312323 IP 192.168.248.132.ssh > pe205-tc.pcsupport.ac.nz.64741: Flags [P.], seq 7680:7740, ack 249, win 698, length 60
00:32:48.313098 IP pe205-tc.pcsupport.ac.nz.64741 > 192.168.248.132.ssh: Flags [.], ack 7740, win 2050, length 0
00:32:48.314083 IP 192.168.248.132.ssh > pe205-tc.pcsupport.ac.nz.64741: Flags [P.], seq 7740:7792, ack 249, win 698, length 52
00:32:48.315311 IP 192.168.248.132.ssh > pe205-tc.pcsupport.ac.nz.64741: Flags [P.], seq 7792:7852, ack 249, win 698, length 60
00:32:48.315959 IP pe205-tc.pcsupport.ac.nz.64741 > 192.168.248.132.ssh: Flags [.], ack 7852, win 2049, length 0
00:32:48.317029 IP 192.168.248.132.ssh > pe205-tc.pcsupport.ac.nz.64741: Flags [P.], seq 7852:7904, ack 249, win 698, length 52
00:32:48.318372 IP 192.168.248.132.ssh > pe205-tc.pcsupport.ac.nz.64741: Flags [P.], seq 7904:7964, ack 249, win 698, length 60
00:32:48.319057 IP pe205-tc.pcsupport.ac.nz.64741 > 192.168.248.132.ssh: Flags [.], ack 7964, win 2049, length 0
00:32:48.320062 IP 192.168.248.132.ssh > pe205-tc.pcsupport.ac.nz.64741: Flags [P.], seq 7964:8008, ack 249, win 698, length 44
00:32:48.321334 IP 192.168.248.132.ssh > pe205-tc.pcsupport.ac.nz.64741: Flags [P.], seq 8008:8068, ack 249, win 698, length 60
00:32:48.322095 IP pe205-tc.pcsupport.ac.nz.64741 > 192.168.248.132.ssh: Flags [.], ack 8068, win 2048, length 0
00:32:48.323067 IP 192.168.248.132.ssh > pe205-tc.pcsupport.ac.nz.64741: Flags [P.], seq 8068:8120, ack 249, win 698, length 52
00:32:48.324394 IP 192.168.248.132.ssh > pe205-tc.pcsupport.ac.nz.64741: Flags [P.], seq 8120:8180, ack 249, win 698, length 60
00:32:48.325134 IP pe205-tc.pcsupport.ac.nz.64741 > 192.168.248.132.ssh: Flags [.], ack 8180, win 2048, length 0
00:32:48.326093 IP 192.168.248.132.ssh > pe205-tc.pcsupport.ac.nz.64741: Flags [P.], seq 8180:8224, ack 249, win 698, length 44
00:32:48.327308 IP 192.168.248.132.ssh > pe205-tc.pcsupport.ac.nz.64741: Flags [P.], seq 8224:8284, ack 249, win 698, length 60
00:32:48.328130 IP pe205-tc.pcsupport.ac.nz.64741 > 192.168.248.132.ssh: Flags [.], ack 8284, win 2047, length 0
00:32:48.329113 IP 192.168.248.132.ssh > pe205-tc.pcsupport.ac.nz.64741: Flags [P.], seq 8284:8336, ack 249, win 698, length 52
00:32:48.330375 IP 192.168.248.132.ssh > pe205-tc.pcsupport.ac.nz.64741: Flags [P.], seq 8336:8396, ack 249, win 698, length 60
00:32:48.331117 IP pe205-tc.pcsupport.ac.nz.64741 > 192.168.248.132.ssh: Flags [.], ack 8396, win 2047, length 0
00:32:48.332176 IP 192.168.248.132.ssh > pe205-tc.pcsupport.ac.nz.64741: Flags [P.], seq 8396:8448, ack 249, win 698, length 52
00:32:48.333421 IP 192.168.248.132.ssh > pe205-tc.pcsupport.ac.nz.64741: Flags [P.], seq 8448:8508, ack 249, win 698, length 60
00:32:48.334097 IP pe205-tc.pcsupport.ac.nz.64741 > 192.168.248.132.ssh: Flags [.], ack 8508, win 2053, length 0
00:32:48.335149 IP 192.168.248.132.ssh > pe205-tc.pcsupport.ac.nz.64741: Flags [P.], seq 8508:8560, ack 249, win 698, length 52
00:32:48.336402 IP 192.168.248.132.ssh > pe205-tc.pcsupport.ac.nz.64741: Flags [P.], seq 8560:8620, ack 249, win 698, length 60
00:32:48.337171 IP pe205-tc.pcsupport.ac.nz.64741 > 192.168.248.132.ssh: Flags [.], ack 8620, win 2052, length 0
00:32:48.338239 IP 192.168.248.132.ssh > pe205-tc.pcsupport.ac.nz.64741: Flags [P.], seq 8620:8664, ack 249, win 698, length 44
00:32:48.339494 IP 192.168.248.132.ssh > pe205-tc.pcsupport.ac.nz.64741: Flags [P.], seq 8664:8724, ack 249, win 698, length 60
00:32:48.340233 IP pe205-tc.pcsupport.ac.nz.64741 > 192.168.248.132.ssh: Flags [.], ack 8724, win 2052, length 0
00:32:48.346211 IP 192.168.248.132.ssh > pe205-tc.pcsupport.ac.nz.64741: Flags [P.], seq 8724:8776, ack 249, win 698, length 52
00:32:48.347606 IP 192.168.248.132.ssh > pe205-tc.pcsupport.ac.nz.64741: Flags [P.], seq 8776:8836, ack 249, win 698, length 60
00:32:48.348277 IP pe205-tc.pcsupport.ac.nz.64741 > 192.168.248.132.ssh: Flags [.], ack 8836, win 2051, length 0
00:32:48.354044 IP 192.168.248.132.ssh > pe205-tc.pcsupport.ac.nz.64741: Flags [P.], seq 8836:8888, ack 249, win 698, length 52
00:32:48.355340 IP 192.168.248.132.ssh > pe205-tc.pcsupport.ac.nz.64741: Flags [P.], seq 8888:8948, ack 249, win 698, length 60
00:32:48.356354 IP pe205-tc.pcsupport.ac.nz.64741 > 192.168.248.132.ssh: Flags [.], ack 8948, win 2051, length 0
00:32:48.357255 IP 192.168.248.132.ssh > pe205-tc.pcsupport.ac.nz.64741: Flags [P.], seq 8948:8992, ack 249, win 698, length 44
00:32:48.358654 IP 192.168.248.132.ssh > pe205-tc.pcsupport.ac.nz.64741: Flags [P.], seq 8992:9052, ack 249, win 698, length 60
00:32:48.359249 IP pe205-tc.pcsupport.ac.nz.64741 > 192.168.248.132.ssh: Flags [P.], seq 249:285, ack 8992, win 2051, length 36
00:32:48.359352 IP pe205-tc.pcsupport.ac.nz.64741 > 192.168.248.132.ssh: Flags [P.], seq 285:321, ack 8992, win 2051, length 36
00:32:48.360818 IP 192.168.248.132.ssh > pe205-tc.pcsupport.ac.nz.64741: Flags [.], ack 321, win 698, length 0
00:32:48.361554 IP 192.168.248.132.ssh > pe205-tc.pcsupport.ac.nz.64741: Flags [P.], seq 9052:9104, ack 321, win 698, length 52
00:32:48.362355 IP pe205-tc.pcsupport.ac.nz.64741 > 192.168.248.132.ssh: Flags [.], ack 9104, win 2050, length 0
00:32:48.363993 IP 192.168.248.132.ssh > pe205-tc.pcsupport.ac.nz.64741: Flags [P.], seq 9104:9224, ack 321, win 698, length 12                                   0
00:32:48.365362 IP 192.168.248.132.ssh > pe205-tc.pcsupport.ac.nz.64741: Flags [P.], seq 9224:9308, ack 321, win 698, length 84
00:32:48.366092 IP pe205-tc.pcsupport.ac.nz.64741 > 192.168.248.132.ssh: Flags [.], ack 9308, win 2050, length 0
00:32:48.367118 IP 192.168.248.132.ssh > pe205-tc.pcsupport.ac.nz.64741: Flags [P.], seq 9308:9360, ack 321, win 698, length 52
00:32:48.368460 IP 192.168.248.132.ssh > pe205-tc.pcsupport.ac.nz.64741: Flags [P.], seq 9360:9428, ack 321, win 698, length 68
00:32:48.369167 IP pe205-tc.pcsupport.ac.nz.64741 > 192.168.248.132.ssh: Flags [.], ack 9428, win 2049, length 0
00:32:48.370193 IP 192.168.248.132.ssh > pe205-tc.pcsupport.ac.nz.64741: Flags [P.], seq 9428:9480, ack 321, win 698, length 52
00:32:48.371431 IP 192.168.248.132.ssh > pe205-tc.pcsupport.ac.nz.64741: Flags [P.], seq 9480:9548, ack 321, win 698, length 68
00:32:48.371975 IP pe205-tc.pcsupport.ac.nz.64741 > 192.168.248.132.ssh: Flags [.], ack 9548, win 2049, length 0
00:32:48.373106 IP 192.168.248.132.ssh > pe205-tc.pcsupport.ac.nz.64741: Flags [P.], seq 9548:9592, ack 321, win 698, length 44
00:32:48.374363 IP 192.168.248.132.ssh > pe205-tc.pcsupport.ac.nz.64741: Flags [P.], seq 9592:9652, ack 321, win 698, length 60
00:32:48.374909 IP pe205-tc.pcsupport.ac.nz.64741 > 192.168.248.132.ssh: Flags [.], ack 9652, win 2048, length 0
00:32:48.376033 IP 192.168.248.132.ssh > pe205-tc.pcsupport.ac.nz.64741: Flags [P.], seq 9652:9704, ack 321, win 698, length 52
00:32:48.377356 IP 192.168.248.132.ssh > pe205-tc.pcsupport.ac.nz.64741: Flags [P.], seq 9704:9764, ack 321, win 698, length 60
00:32:48.378144 IP pe205-tc.pcsupport.ac.nz.64741 > 192.168.248.132.ssh: Flags [.], ack 9764, win 2048, length 0
00:32:48.379155 IP 192.168.248.132.ssh > pe205-tc.pcsupport.ac.nz.64741: Flags [P.], seq 9764:9808, ack 321, win 698, length 44
00:32:48.380498 IP 192.168.248.132.ssh > pe205-tc.pcsupport.ac.nz.64741: Flags [P.], seq 9808:9868, ack 321, win 698, length 60
00:32:48.381274 IP pe205-tc.pcsupport.ac.nz.64741 > 192.168.248.132.ssh: Flags [.], ack 9868, win 2047, length 0
00:32:48.382243 IP 192.168.248.132.ssh > pe205-tc.pcsupport.ac.nz.64741: Flags [P.], seq 9868:9920, ack 321, win 698, length 52
00:32:48.383475 IP 192.168.248.132.ssh > pe205-tc.pcsupport.ac.nz.64741: Flags [P.], seq 9920:9980, ack 321, win 698, length 60
00:32:48.384160 IP pe205-tc.pcsupport.ac.nz.64741 > 192.168.248.132.ssh: Flags [.], ack 9980, win 2053, length 0
00:32:48.385207 IP 192.168.248.132.ssh > pe205-tc.pcsupport.ac.nz.64741: Flags [P.], seq 9980:10032, ack 321, win 698, length 5                                   2
00:32:48.386474 IP 192.168.248.132.ssh > pe205-tc.pcsupport.ac.nz.64741: Flags [P.], seq 10032:10092, ack 321, win 698, length                                    60
00:32:48.387241 IP pe205-tc.pcsupport.ac.nz.64741 > 192.168.248.132.ssh: Flags [.], ack 10092, win 2052, length 0
00:32:48.388425 IP 192.168.248.132.ssh > pe205-tc.pcsupport.ac.nz.64741: Flags [P.], seq 10092:10144, ack 321, win 698, length                                    52
00:32:48.389849 IP 192.168.248.132.ssh > pe205-tc.pcsupport.ac.nz.64741: Flags [P.], seq 10144:10204, ack 321, win 698, length                                    60
00:32:48.390615 IP pe205-tc.pcsupport.ac.nz.64741 > 192.168.248.132.ssh: Flags [.], ack 10204, win 2052, length 0
00:32:48.391592 IP 192.168.248.132.ssh > pe205-tc.pcsupport.ac.nz.64741: Flags [P.], seq 10204:10256, ack 321, win 698, length                                    52
00:32:48.392835 IP 192.168.248.132.ssh > pe205-tc.pcsupport.ac.nz.64741: Flags [P.], seq 10256:10316, ack 321, win 698, length                                    60
00:32:48.393603 IP pe205-tc.pcsupport.ac.nz.64741 > 192.168.248.132.ssh: Flags [.], ack 10316, win 2051, length 0
00:32:48.394697 IP 192.168.248.132.ssh > pe205-tc.pcsupport.ac.nz.64741: Flags [P.], seq 10316:10368, ack 321, win 698, length                                    52
00:32:48.396054 IP 192.168.248.132.ssh > pe205-tc.pcsupport.ac.nz.64741: Flags [P.], seq 10368:10428, ack 321, win 698, length                                    60
00:32:48.396825 IP pe205-tc.pcsupport.ac.nz.64741 > 192.168.248.132.ssh: Flags [.], ack 10428, win 2051, length 0
00:32:48.397812 IP 192.168.248.132.ssh > pe205-tc.pcsupport.ac.nz.64741: Flags [P.], seq 10428:10480, ack 321, win 698, length                                    52
00:32:48.399158 IP 192.168.248.132.ssh > pe205-tc.pcsupport.ac.nz.64741: Flags [P.], seq 10480:10540, ack 321, win 698, length                                    60
00:32:48.399925 IP pe205-tc.pcsupport.ac.nz.64741 > 192.168.248.132.ssh: Flags [.], ack 10540, win 2050, length 0
00:32:48.400905 IP 192.168.248.132.ssh > pe205-tc.pcsupport.ac.nz.64741: Flags [P.], seq 10540:10584, ack 321, win 698, length                                    44
00:32:48.402239 IP 192.168.248.132.ssh > pe205-tc.pcsupport.ac.nz.64741: Flags [P.], seq 10584:10644, ack 321, win 698, length                                    60
00:32:48.403004 IP pe205-tc.pcsupport.ac.nz.64741 > 192.168.248.132.ssh: Flags [.], ack 10644, win 2050, length 0
00:32:48.404104 IP 192.168.248.132.ssh > pe205-tc.pcsupport.ac.nz.64741: Flags [P.], seq 10644:10696, ack 321, win 698, length                                    52
00:32:48.405395 IP 192.168.248.132.ssh > pe205-tc.pcsupport.ac.nz.64741: Flags [P.], seq 10696:10756, ack 321, win 698, length                                    60
00:32:48.406163 IP pe205-tc.pcsupport.ac.nz.64741 > 192.168.248.132.ssh: Flags [.], ack 10756, win 2050, length 0
00:32:48.407127 IP 192.168.248.132.ssh > pe205-tc.pcsupport.ac.nz.64741: Flags [P.], seq 10756:10808, ack 321, win 698, length                                    52
00:32:48.408515 IP 192.168.248.132.ssh > pe205-tc.pcsupport.ac.nz.64741: Flags [P.], seq 10808:10868, ack 321, win 698, length                                    60
00:32:48.409199 IP pe205-tc.pcsupport.ac.nz.64741 > 192.168.248.132.ssh: Flags [.], ack 10868, win 2049, length 0
00:32:48.410241 IP 192.168.248.132.ssh > pe205-tc.pcsupport.ac.nz.64741: Flags [P.], seq 10868:10920, ack 321, win 698, length                                    52
00:32:48.411477 IP 192.168.248.132.ssh > pe205-tc.pcsupport.ac.nz.64741: Flags [P.], seq 10920:10980, ack 321, win 698, length                                    60
